{
  "$schema": "https://json-schema.org/draft/2020-12/schema",
  "type": "object",
  "properties": {
    "report_id": {
      "type": "string",
      "minLength": 1,
      "maxLength": 160
    },
    "session_id": {
      "type": "string",
      "minLength": 1,
      "maxLength": 160
    },
    "state_revision": {
      "type": "integer",
      "minimum": 0
    },
    "architecture_version": {
      "const": "1.1"
    },
    "curriculum_version": {
      "const": "1.1.0"
    },
    "status": {
      "type": "string",
      "enum": [
        "COMPLETED",
        "INTERRUPTED",
        "BOUNDARY_REACHED",
        "IN_PROGRESS"
      ]
    },
    "targets_attempted": {
      "type": "array",
      "items": {
        "type": "string",
        "pattern": "^[A-Z][0-9]{2}$"
      },
      "maxItems": 100
    },
    "independent_evidence": {
      "type": "array",
      "items": {
        "type": "object",
        "properties": {
          "statement": {
            "type": "string",
            "maxLength": 2000
          },
          "skill_id": {
            "anyOf": [
              {
                "type": "string",
                "pattern": "^[A-Z][0-9]{2}$"
              },
              {
                "type": "null"
              }
            ]
          },
          "component_id": {
            "anyOf": [
              {
                "type": "string",
                "minLength": 1,
                "maxLength": 160
              },
              {
                "type": "null"
              }
            ]
          },
          "event_ids": {
            "type": "array",
            "items": {
              "type": "string",
              "minLength": 1,
              "maxLength": 160
            },
            "maxItems": 100
          },
          "review_scope": {
            "type": "string",
            "maxLength": 2000
          }
        },
        "required": [
          "statement",
          "skill_id",
          "component_id",
          "event_ids",
          "review_scope"
        ],
        "additionalProperties": false
      },
      "maxItems": 100
    },
    "guided_work": {
      "type": "array",
      "items": {
        "type": "object",
        "properties": {
          "statement": {
            "type": "string",
            "maxLength": 2000
          },
          "skill_id": {
            "anyOf": [
              {
                "type": "string",
                "pattern": "^[A-Z][0-9]{2}$"
              },
              {
                "type": "null"
              }
            ]
          },
          "component_id": {
            "anyOf": [
              {
                "type": "string",
                "minLength": 1,
                "maxLength": 160
              },
              {
                "type": "null"
              }
            ]
          },
          "event_ids": {
            "type": "array",
            "items": {
              "type": "string",
              "minLength": 1,
              "maxLength": 160
            },
            "maxItems": 100
          },
          "review_scope": {
            "type": "string",
            "maxLength": 2000
          }
        },
        "required": [
          "statement",
          "skill_id",
          "component_id",
          "event_ids",
          "review_scope"
        ],
        "additionalProperties": false
      },
      "maxItems": 100
    },
    "repairs_and_returns": {
      "type": "array",
      "items": {
        "type": "object",
        "properties": {
          "statement": {
            "type": "string",
            "maxLength": 2000
          },
          "skill_id": {
            "anyOf": [
              {
                "type": "string",
                "pattern": "^[A-Z][0-9]{2}$"
              },
              {
                "type": "null"
              }
            ]
          },
          "component_id": {
            "anyOf": [
              {
                "type": "string",
                "minLength": 1,
                "maxLength": 160
              },
              {
                "type": "null"
              }
            ]
          },
          "event_ids": {
            "type": "array",
            "items": {
              "type": "string",
              "minLength": 1,
              "maxLength": 160
            },
            "maxItems": 100
          },
          "review_scope": {
            "type": "string",
            "maxLength": 2000
          }
        },
        "required": [
          "statement",
          "skill_id",
          "component_id",
          "event_ids",
          "review_scope"
        ],
        "additionalProperties": false
      },
      "maxItems": 100
    },
    "immediate_criteria": {
      "type": "array",
      "items": {
        "type": "object",
        "properties": {
          "statement": {
            "type": "string",
            "maxLength": 2000
          },
          "skill_id": {
            "anyOf": [
              {
                "type": "string",
                "pattern": "^[A-Z][0-9]{2}$"
              },
              {
                "type": "null"
              }
            ]
          },
          "component_id": {
            "anyOf": [
              {
                "type": "string",
                "minLength": 1,
                "maxLength": 160
              },
              {
                "type": "null"
              }
            ]
          },
          "event_ids": {
            "type": "array",
            "items": {
              "type": "string",
              "minLength": 1,
              "maxLength": 160
            },
            "maxItems": 100
          },
          "review_scope": {
            "type": "string",
            "maxLength": 2000
          }
        },
        "required": [
          "statement",
          "skill_id",
          "component_id",
          "event_ids",
          "review_scope"
        ],
        "additionalProperties": false
      },
      "maxItems": 100
    },
    "transfer_evidence": {
      "type": "array",
      "items": {
        "type": "object",
        "properties": {
          "statement": {
            "type": "string",
            "maxLength": 2000
          },
          "skill_id": {
            "anyOf": [
              {
                "type": "string",
                "pattern": "^[A-Z][0-9]{2}$"
              },
              {
                "type": "null"
              }
            ]
          },
          "component_id": {
            "anyOf": [
              {
                "type": "string",
                "minLength": 1,
                "maxLength": 160
              },
              {
                "type": "null"
              }
            ]
          },
          "event_ids": {
            "type": "array",
            "items": {
              "type": "string",
              "minLength": 1,
              "maxLength": 160
            },
            "maxItems": 100
          },
          "review_scope": {
            "type": "string",
            "maxLength": 2000
          }
        },
        "required": [
          "statement",
          "skill_id",
          "component_id",
          "event_ids",
          "review_scope"
        ],
        "additionalProperties": false
      },
      "maxItems": 100
    },
    "retention_evidence": {
      "type": "array",
      "items": {
        "type": "object",
        "properties": {
          "statement": {
            "type": "string",
            "maxLength": 2000
          },
          "skill_id": {
            "anyOf": [
              {
                "type": "string",
                "pattern": "^[A-Z][0-9]{2}$"
              },
              {
                "type": "null"
              }
            ]
          },
          "component_id": {
            "anyOf": [
              {
                "type": "string",
                "minLength": 1,
                "maxLength": 160
              },
              {
                "type": "null"
              }
            ]
          },
          "event_ids": {
            "type": "array",
            "items": {
              "type": "string",
              "minLength": 1,
              "maxLength": 160
            },
            "maxItems": 100
          },
          "review_scope": {
            "type": "string",
            "maxLength": 2000
          }
        },
        "required": [
          "statement",
          "skill_id",
          "component_id",
          "event_ids",
          "review_scope"
        ],
        "additionalProperties": false
      },
      "maxItems": 100
    },
    "hypotheses": {
      "type": "array",
      "items": {
        "type": "object",
        "properties": {
          "kind": {
            "type": "string",
            "enum": [
              "OBSERVATION",
              "HYPOTHESIS",
              "INSTRUCTIONAL_TRIAL"
            ]
          },
          "statement": {
            "type": "string",
            "maxLength": 2000
          },
          "evidence_event_ids": {
            "type": "array",
            "items": {
              "type": "string",
              "minLength": 1,
              "maxLength": 160
            },
            "maxItems": 100
          },
          "hypothesis_status": {
            "anyOf": [
              {
                "type": "string",
                "enum": [
                  "UNRESOLVED",
                  "PROVISIONAL",
                  "SUPPORTED_FOR_OBSERVED_PATTERN",
                  "CONTRADICTED"
                ]
              },
              {
                "type": "null"
              }
            ]
          }
        },
        "required": [
          "kind",
          "statement",
          "evidence_event_ids",
          "hypothesis_status"
        ],
        "additionalProperties": false
      },
      "maxItems": 100
    },
    "unresolved_or_untested": {
      "type": "array",
      "items": {
        "type": "string",
        "maxLength": 2000
      },
      "maxItems": 100
    },
    "next_evidence_needed": {
      "type": "array",
      "items": {
        "type": "string",
        "maxLength": 2000
      },
      "maxItems": 100
    },
    "policy_note": {
      "type": "string",
      "maxLength": 2000
    },
    "created_at": {
      "type": "string",
      "minLength": 1,
      "maxLength": 160
    }
  },
  "required": [
    "report_id",
    "session_id",
    "state_revision",
    "architecture_version",
    "curriculum_version",
    "status",
    "targets_attempted",
    "independent_evidence",
    "guided_work",
    "repairs_and_returns",
    "immediate_criteria",
    "transfer_evidence",
    "retention_evidence",
    "hypotheses",
    "unresolved_or_untested",
    "next_evidence_needed",
    "policy_note",
    "created_at"
  ],
  "additionalProperties": false
}
